<xs:schema xmlns:xs="http://www.w3.org/2001/XMLSchema" elementFormDefault="qualified">
    <xs:element name="tabla">
        <xs:complexType>
            <xs:sequence>
                <xs:element name="tempActual" type="xs:int" />
                <xs:element name="club">
                    <xs:complexType>
                        <xs:sequence>
                            <xs:element name="equipo">
                                <xs:complexType>
                                    <xs:sequence>
                                        <xs:element name="nombre" type="xs:string" />
                                        <xs:element name="enlace" type="xs:string" />
                                        <xs:element name="imagen" type="xs:string" />
                                    </xs:sequence>
                                </xs:complexType>
                            </xs:element>
                            <xs:element name="puntuacion">
                                <xs:complexType>
                                    <xs:sequence>
                                        <xs:element name="G" type="xs:int" />
                                        <xs:element name="E" type="xs:int" />
                                        <xs:element name="P" type="xs:int" />
                                        <xs:element name="J" type="xs:int" />
                                        <xs:element name="PF" type="xs:int" />
                                        <xs:element name="PC" type="xs:int" />
                                        <xs:element name="PT" type="xs:int" />
                                    </xs:sequence>
                                </xs:complexType>
                            </xs:element>
                        </xs:sequence>
                    </xs:complexType>
                </xs:element>
                <xs:element name="club">
                    <xs:complexType>
                        <xs:sequence>
                            <xs:element name="equipo">
                                <xs:complexType>
                                    <xs:sequence>
                                        <xs:element name="nombre" type="xs:string" />
                                        <xs:element name="enlace" type="xs:string" />
                                        <xs:element name="imagen" type="xs:string" />
                                    </xs:sequence>
                                </xs:complexType>
                            </xs:element>
                            <xs:element name="puntuacion">
                                <xs:complexType>
                                    <xs:sequence>
                                        <xs:element name="G" type="xs:int" />
                                        <xs:element name="E" type="xs:int" />
                                        <xs:element name="P" type="xs:int" />
                                        <xs:element name="J" type="xs:int" />
                                        <xs:element name="PF" type="xs:int" />
                                        <xs:element name="PC" type="xs:int" />
                                        <xs:element name="PT" type="xs:int" />
                                    </xs:sequence>
                                </xs:complexType>
                            </xs:element>
                        </xs:sequence>
                    </xs:complexType>
                </xs:element>
                <xs:element name="club">
                    <xs:complexType>
                        <xs:sequence>
                            <xs:element name="equipo">
                                <xs:complexType>
                                    <xs:sequence>
                                        <xs:element name="nombre" type="xs:string" />
                                        <xs:element name="enlace" type="xs:string" />
                                        <xs:element name="imagen" type="xs:string" />
                                    </xs:sequence>
                                </xs:complexType>
                            </xs:element>
                            <xs:element name="puntuacion">
                                <xs:complexType>
                                    <xs:sequence>
                                        <xs:element name="G" type="xs:int" />
                                        <xs:element name="E" type="xs:int" />
                                        <xs:element name="P" type="xs:int" />
                                        <xs:element name="J" type="xs:int" />
                                        <xs:element name="PF" type="xs:int" />
                                        <xs:element name="PC" type="xs:int" />
                                        <xs:element name="PT" type="xs:int" />
                                    </xs:sequence>
                                </xs:complexType>
                            </xs:element>
                        </xs:sequence>
                    </xs:complexType>
                </xs:element>
                <xs:element name="club">
                    <xs:complexType>
                        <xs:sequence>
                            <xs:element name="equipo">
                                <xs:complexType>
                                    <xs:sequence>
                                        <xs:element name="nombre" type="xs:string" />
                                        <xs:element name="enlace" type="xs:string" />
                                        <xs:element name="imagen" type="xs:string" />
                                    </xs:sequence>
                                </xs:complexType>
                            </xs:element>
                            <xs:element name="puntuacion">
                                <xs:complexType>
                                    <xs:sequence>
                                        <xs:element name="G" type="xs:int" />
                                        <xs:element name="E" type="xs:int" />
                                        <xs:element name="P" type="xs:int" />
                                        <xs:element name="J" type="xs:int" />
                                        <xs:element name="PF" type="xs:int" />
                                        <xs:element name="PC" type="xs:int" />
                                        <xs:element name="PT" type="xs:int" />
                                    </xs:sequence>
                                </xs:complexType>
                            </xs:element>
                        </xs:sequence>
                    </xs:complexType>
                </xs:element>
                <xs:element name="club">
                    <xs:complexType>
                        <xs:sequence>
                            <xs:element name="equipo">
                                <xs:complexType>
                                    <xs:sequence>
                                        <xs:element name="nombre" type="xs:string" />
                                        <xs:element name="enlace" type="xs:string" />
                                        <xs:element name="imagen" type="xs:string" />
                                    </xs:sequence>
                                </xs:complexType>
                            </xs:element>
                            <xs:element name="puntuacion">
                                <xs:complexType>
                                    <xs:sequence>
                                        <xs:element name="G" type="xs:int" />
                                        <xs:element name="E" type="xs:int" />
                                        <xs:element name="P" type="xs:int" />
                                        <xs:element name="J" type="xs:int" />
                                        <xs:element name="PF" type="xs:int" />
                                        <xs:element name="PC" type="xs:int" />
                                        <xs:element name="PT" type="xs:int" />
                                    </xs:sequence>
                                </xs:complexType>
                            </xs:element>
                        </xs:sequence>
                    </xs:complexType>
                </xs:element>
                <xs:element name="club">
                    <xs:complexType>
                        <xs:sequence>
                            <xs:element name="equipo">
                                <xs:complexType>
                                    <xs:sequence>
                                        <xs:element name="nombre" type="xs:string" />
                                        <xs:element name="enlace" type="xs:string" />
                                        <xs:element name="imagen" type="xs:string" />
                                    </xs:sequence>
                                </xs:complexType>
                            </xs:element>
                            <xs:element name="puntuacion">
                                <xs:complexType>
                                    <xs:sequence>
                                        <xs:element name="G" type="xs:int" />
                                        <xs:element name="E" type="xs:int" />
                                        <xs:element name="P" type="xs:int" />
                                        <xs:element name="J" type="xs:int" />
                                        <xs:element name="PF" type="xs:int" />
                                        <xs:element name="PC" type="xs:int" />
                                        <xs:element name="PT" type="xs:int" />
                                    </xs:sequence>
                                </xs:complexType>
                            </xs:element>
                        </xs:sequence>
                    </xs:complexType>
                </xs:element>
                <xs:element name="club">
                    <xs:complexType>
                        <xs:sequence>
                            <xs:element name="equipo">
                                <xs:complexType>
                                    <xs:sequence>
                                        <xs:element name="nombre" type="xs:string" />
                                        <xs:element name="enlace" type="xs:string" />
                                        <xs:element name="imagen" type="xs:string" />
                                    </xs:sequence>
                                </xs:complexType>
                            </xs:element>
                            <xs:element name="puntuacion">
                                <xs:complexType>
                                    <xs:sequence>
                                        <xs:element name="G" type="xs:int" />
                                        <xs:element name="E" type="xs:int" />
                                        <xs:element name="P" type="xs:int" />
                                        <xs:element name="J" type="xs:int" />
                                        <xs:element name="PF" type="xs:int" />
                                        <xs:element name="PC" type="xs:int" />
                                        <xs:element name="PT" type="xs:int" />
                                    </xs:sequence>
                                </xs:complexType>
                            </xs:element>
                        </xs:sequence>
                    </xs:complexType>
                </xs:element>
                <xs:element name="club">
                    <xs:complexType>
                        <xs:sequence>
                            <xs:element name="equipo">
                                <xs:complexType>
                                    <xs:sequence>
                                        <xs:element name="nombre" type="xs:string" />
                                        <xs:element name="enlace" type="xs:string" />
                                        <xs:element name="imagen" type="xs:string" />
                                    </xs:sequence>
                                </xs:complexType>
                            </xs:element>
                            <xs:element name="puntuacion">
                                <xs:complexType>
                                    <xs:sequence>
                                        <xs:element name="G" type="xs:int" />
                                        <xs:element name="E" type="xs:int" />
                                        <xs:element name="P" type="xs:int" />
                                        <xs:element name="J" type="xs:int" />
                                        <xs:element name="PF" type="xs:int" />
                                        <xs:element name="PC" type="xs:int" />
                                        <xs:element name="PT" type="xs:int" />
                                    </xs:sequence>
                                </xs:complexType>
                            </xs:element>
                        </xs:sequence>
                    </xs:complexType>
                </xs:element>
                <xs:element name="club">
                    <xs:complexType>
                        <xs:sequence>
                            <xs:element name="equipo">
                                <xs:complexType>
                                    <xs:sequence>
                                        <xs:element name="nombre" type="xs:string" />
                                        <xs:element name="enlace" type="xs:string" />
                                        <xs:element name="imagen" type="xs:string" />
                                    </xs:sequence>
                                </xs:complexType>
                            </xs:element>
                            <xs:element name="puntuacion">
                                <xs:complexType>
                                    <xs:sequence>
                                        <xs:element name="G" type="xs:int" />
                                        <xs:element name="E" type="xs:int" />
                                        <xs:element name="P" type="xs:int" />
                                        <xs:element name="J" type="xs:int" />
                                        <xs:element name="PF" type="xs:int" />
                                        <xs:element name="PC" type="xs:int" />
                                        <xs:element name="PT" type="xs:int" />
                                    </xs:sequence>
                                </xs:complexType>
                            </xs:element>
                        </xs:sequence>
                    </xs:complexType>
                </xs:element>
                <xs:element name="club">
                    <xs:complexType>
                        <xs:sequence>
                            <xs:element name="equipo">
                                <xs:complexType>
                                    <xs:sequence>
                                        <xs:element name="nombre" type="xs:string" />
                                        <xs:element name="enlace" type="xs:string" />
                                        <xs:element name="imagen" type="xs:string" />
                                    </xs:sequence>
                                </xs:complexType>
                            </xs:element>
                            <xs:element name="puntuacion">
                                <xs:complexType>
                                    <xs:sequence>
                                        <xs:element name="G" type="xs:int" />
                                        <xs:element name="E" type="xs:int" />
                                        <xs:element name="P" type="xs:int" />
                                        <xs:element name="J" type="xs:int" />
                                        <xs:element name="PF" type="xs:int" />
                                        <xs:element name="PC" type="xs:int" />
                                        <xs:element name="PT" type="xs:int" />
                                    </xs:sequence>
                                </xs:complexType>
                            </xs:element>
                        </xs:sequence>
                    </xs:complexType>
                </xs:element>
            </xs:sequence>
        </xs:complexType>
    </xs:element>
</xs:schema>